{
  "record_id": "mem_v1_labnode_guardian_observation_24fd810aa6c2",
  "schema_version": "1.0.0",
  "event_type": "guardian_observation",
  "timestamp": "2026-06-09T14:20:00+00:00",
  "source_node": "lab-node-a",
  "source_system": "guardian.synthetic",
  "source_agent": "guardian",
  "sensor_type": "",
  "modality": "agent_trace",
  "summary": "Synthetic Guardian observation: schema-example creation classified as ALLOW with OBSERVE_ONLY boundary.",
  "content_ref": "examples/synthetic_guardian/phase1c-guardian-observation.json",
  "content_hash": "sha256:24fd810aa6c2674d312a4ac0292b3319f80e3d91000000000000000000000005",
  "confidence": 0.99,
  "privacy_class": "internal",
  "retention_policy": "guardian-audit-365d",
  "governance_state": "reviewed",
  "replay_pointer": {
    "available": true,
    "replay_id": "replay_phase1c_guardian_001",
    "source_path": "examples/synthetic_guardian/phase1c-guardian-observation.json",
    "source_line": 1,
    "timestamp": "2026-06-09T14:20:00+00:00",
    "checksum": "sha256:24fd810aa6c2674d312a4ac0292b3319f80e3d91000000000000000000000005",
    "manifest_ref": "replay/data_catalog/replay_manifest.json",
    "phase": "phase_1c_schema_examples",
    "causal_event_id": "cause_phase1c_guardian_001",
    "root_event_id": "root_phase1c_examples",
    "reason": ""
  },
  "embedding_ref": null,
  "tags": [
    "phase1c",
    "guardian",
    "observe-only",
    "allow"
  ],
  "lineage": {
    "parent_record_ids": [
      "mem_v1_labnode_agent_action_9b12d0ef77c1"
    ],
    "root_record_id": "mem_v1_labnode_agent_action_9b12d0ef77c1",
    "derived_from": [
      "synthetic_guardian_check"
    ],
    "transformation": "guardian_observation_summary"
  },
  "created_by": "codex",
  "created_at": "2026-06-09T14:20:05+00:00"
}
